{
  "title": "BMGEN: Battery Model Generator",
  "description": "A Python-based test program generator for battery cyclers that allows users to define battery testing protocols and export them to multiple formats such as Basytec, Neware, Digatron, and JSON-LD. It provides both a CLI and web interface for creating standardized and reproducible battery test procedures.",
  "category": "cyclic-testing",
  "subcategory": "software",
  "link": "https://pypi.org/project/bm-generator/",
  "repository": "https://github.com/DigiBatt/bmgen",
  "documentation": "https://digibatt.github.io/bmgen",
  "doi": "",
  "language": ["Python"],
  "license": ["MIT"],
  "authors": ["Elias Barbers"],
  "funding_source": ["Horizon Europe DigiBatt project"]
}
