{
  "title": "ECHOED: Battery Digital Twin Framework",
  "description": "A modular digital twin framework for batteries and electrochemical systems. Echoed connects models, data, and metadata into a living, updatable representation of a physical cell or system. It builds on open ontologies and interoperable formats, so that experimental data, simulations, and analytics can all flow into the same consistent digital twin.",
  "category": "simulation-and-parameterisation",
  "subcategory": "software",
  "link": "https://github.com/DigiBatt/echoed",
  "repository": "https://github.com/DigiBatt/echoed",
  "documentation": "https://github.com/DigiBatt/echoed",
  "doi": "",
  "language": ["Python"],
  "license": ["GPL-3.0"],
  "authors": ["DigiBatt project contributors"],
  "funding_source": ["Horizon Europe DigiBatt project"]
}