{
  "title": "BDAT: Battery Data Analysis Toolkit",
  "description": "A Python toolkit for importing, processing, and analysing electrical battery data. It provides functions for handling battery test data and integrates with Kadi4Mat while also supporting standalone workflows.",
  "category": "data-repositories",
  "subcategory": "software",
  "link": "https://pypi.org/project/bdat/",
  "repository": "https://github.com/DigiBatt/bdat",
  "documentation": "https://digibatt.github.io/bdat/",
  "doi": "",
  "language": ["Python"],
  "license": ["MIT"],
  "authors": ["Elias Barbers"],
  "funding_source": ["Horizon Europe DigiBatt project"]
}