{
  "title": "PyBaMM",
  "description": "Python Battery Mathematical Modelling: an open-source Python package for simulating battery models.",
  "category": "simulation-and-parameterisation",
  "subcategory": "software",
  "link": "https://pybamm.org/",
  "repository": "https://github.com/pybamm-team/PyBaMM",
  "documentation": "https://docs.pybamm.org/",
  "doi": "10.5334/jors.309",
  "language": [
    "Python"
  ],
  "license": [
    "BSD-3-Clause"
  ],
  "authors": [
    "Valentin Sulzer",
    "Scott G. Marquis",
    "Robert Timms",
    "Martin Robinson",
    "S. Jon Chapman"
  ]
}